abstract,study_type,year,url,title
"Depression is a prevalent psychiatric disorder that often leads to poor quality of life and impaired functioning. Treatment during the acute phase of a major depressive episode aims to help the patient reach a remission state and eventually return to their baseline level of functioning. Pharmacotherapy, especially selective serotonin reuptake inhibitors antidepressants, remains the most frequent option for treating depression during the acute phase, while other promising pharmacological options are still competing for the attention of practitioners. Depression-focused psychotherapy is the second most common option for helping patients overcome the acute phase, maintain remission, and prevent relapses. Electroconvulsive therapy is the most effective somatic therapy for depression in some specific situations; meanwhile, other methods have limits, and their specific indications are still being studied. Combining medications, psychotherapy, and somatic therapies remains the most effective way to manage resistant forms of depression.",literature_review,2021,https://pmc.ncbi.nlm.nih.gov/articles/PMC8610877/,Major depressive disorder: Validated treatments and future challenges
"Depression is one of the leading causes of disability, and, if left unmanaged, it can increase the risk for suicide. The evidence base on the determinants of depression is fragmented, which makes the interpretation of the results across studies difficult. The objective of this study is to conduct a thorough synthesis of the literature assessing the biological, psychological, and social determinants of depression in order to piece together the puzzle of the key factors that are related to this condition. Titles and abstracts published between 2017 and 2020 were identified in PubMed, as well as Medline, Scopus, and PsycInfo. Key words relating to biological, social, and psychological determinants as well as depression were applied to the databases, and the screening and data charting of the documents took place. We included 470 documents in this literature review. The findings showed that there are a plethora of risk and protective factors (relating to biological, psychological, and social determinants) that are related to depression; these determinants are interlinked and influence depression outcomes through a web of causation. In this paper, we describe and present the vast, fragmented, and complex literature related to this topic. This review may be used to guide practice, public health efforts, policy, and research related to mental health and, specifically, depression.",literature_review,2021,https://pubmed.ncbi.nlm.nih.gov/34942936/,"Biological, Psychological, and Social Determinants of Depression: A Review of Recent Literature"
"Depression is the most prevalent psychiatric disorder in the world, affecting 4.4% of the global population. Despite an array of treatment modalities, depressive disorders remain difficult to manage due to many factors. Beginning with the introduction of fluoxetine to the United States in 1988, selective serotonin reuptake inhibitors (SSRIs) quickly became a mainstay of treatment for a variety of psychiatric disorders. The primary mechanism of action of SSRIs is to inhibit presynaptic reuptake of serotonin at the serotonin transporter, subsequently increasing serotonin at the postsynaptic membrane in the serotonergic synapse. The six major SSRIs that are marketed in the USA today, fluoxetine, citalopram, escitalopram, paroxetine, sertraline, and fluvoxamine, are a group of structurally unrelated molecules that share a similar mechanism of action. While their primary mechanism of action is similar, each SSRI has unique pharmacokinetics, pharmacodynamics, and side effect profile. One of the more controversial adverse effects of SSRIs is the black box warning for increased risk of suicidality in children and young adults aged 18-24. There is a lack of understanding of the complexities and interactions between SSRIs in the developing brain of a young person with depression. Adults, who do not have certain risk factors, which could be confounding factors, do not seem to carry this increased risk of suicidality. Ultimately, when prescribing SSRIs to any patient, a risk-benefit analysis must factor in the potential treatment effects, adverse effects, and dangers of the illness to be treated. The aim of this review is to educate clinicians on potential adverse effects of SSRIs.",literature_review,2021,https://pmc.ncbi.nlm.nih.gov/articles/PMC8395812/,Selective Serotonin Reuptake Inhibitors and Adverse Effects: A Narrative Review
"Background: Botulinum toxin treatment is the most frequently performed noninvasive cosmetic procedure performed in the USA. Because of its widespread use, an analysis of the adverse event (AE) profile of Botox injections is needed. Methods: The FDA Adverse Event Report System was queried using an online web-based tool to determine the top 15 adverse events reported for four Botox brand names: Botox/Botox Cosmetic, Dysport, and Xeomin. The proportional reporting ratios (PRR) and relative odds ratios (ROR) were determined. A literature review was performed for eight AEs of clinical significance: eyelid/eyebrow ptosis, asthenia, muscular weakness, facial paresis, dysphagia, botulism, and death. Results: Botox/Botox Cosmetic had 38367 AEs. Dysport had 3582 AEs. Xeomin had 1405 AEs. All drugs with reported cases of eyelid and eyebrow ptosis had significant PRR and ROR values. The PRR and ROR values for asthenia were not significant in any of the drugs and only reached significance for Dysport for muscular weakness and dysphagia. Both Botox/Botox Cosmetic and Dysport had elevated PRRs and RORs for facial paresis and botulism. While all drugs had at least one reported case of death related to Botox injection use, none of the PRR or ROR values were significant. Conclusion: Known AEs for Botox injection use include eyelid/brow ptosis and muscular weakness. Feared but rare complications of Botox injection use include dysphagia, botulism, and possibly death, owing to systemic spread of the toxin. This is the first study to analyze the AE data reported to the FDA on Botox injection use.",literature_review,2021,https://pubmed.ncbi.nlm.nih.gov/33128076/,Adverse Events Associated With Botox as Reported in a Food and Drug Administration Database
"Background: Botulinum toxin A (botulinum toxin A) was found to provide a wide variety of therapeutic and aesthetic benefits as one of the most potent toxins in the world. Injectable remedies, including soft tissue fillers and botulinum toxin, have become very common in wrinkling and face rejuvenation management. While these methods of treatment are relatively safe, serious side effects can occur. In this review, the complications of BoNTA are highlighted. Methods: A literature research considered published journal articles (clinical trials or scientific reviews). Electronic databases (PubMed, Scopus, Science Direct) were searched using key terms, and for identification of additional relevant studies, reference lists have also been examined. Only articles published in English were included in this review with a time restriction from 2000 to 2020. Results: There are various injection-related adverse effects associated (AE) with botulinum toxins such as erythema, oedema, pain, ptosis of eyelid or brow and ecchymosis. The overall majority of adverse events identified are mild and temporary. Conclusion: As the use of toxins becomes increasingly more common, adverse events can be expected to increase as well. The practitioners need to be aware of such AEs, and the patients should be informed of these before undertaking such procedures.",literature_review,2021,https://pubmed.ncbi.nlm.nih.gov/33051718/,A Review of Complications Due to the Use of Botulinum Toxin A for Cosmetic Indications
"This review discusses the clinical and preclinical evidence supporting botulinum neurotoxin type A (BoNT/A) therapy as a potential treatment for major depressive disorder (MDD). It explores the mechanisms by which BoNT/A may exert antidepressant effects, including facial feedback, social feedback, and neurobiological changes such as upregulation of brain-derived neurotrophic factor (BDNF) levels. The review highlights the need for further research to clarify the therapeutic mechanisms and efficacy of BoNT/A in treating depression.",literature_review,2021,https://www.frontiersin.org/journals/psychiatry/articles/10.3389/fpsyt.2021.584416/full,Botulinum Neurotoxin Therapy for Depression - Frontiers
"Cognitive behavioral therapy (CBT) is one of the most evidence-based psychological interventions for the treatment of several psychiatric disorders such as depression, anxiety disorders, somatoform disorder, and substance use disorder. The uses are recently extended to psychotic disorders, behavioral medicine, marital discord, stressful life situations, and many other clinical conditions. A sufficient number of researches have been conducted and shown the efficacy of CBT in depressive disorders.",literature_review,2020,https://pmc.ncbi.nlm.nih.gov/articles/PMC7001356/,Cognitive Behavioral Therapy for Depression - PMC
"Ivermectin is a macrolide antiparasitic drug with a 16-membered ring that is widely used for the treatment of many parasitic diseases such as river blindness, elephantiasis and scabies. Recently, ivermectin has been reported to inhibit the proliferation of several tumor cells by regulating multiple signaling pathways. This suggests that ivermectin may be an anticancer drug with great potential. Here, we reviewed the related mechanisms by which ivermectin inhibited the development of different cancers and promoted programmed cell death and discussed the prospects for the clinical application of ivermectin as an anticancer drug for neoplasm therapy.",literature_review,2020,https://pmc.ncbi.nlm.nih.gov/articles/PMC7505114/,"Ivermectin, a potential anticancer drug derived from an antiparasitic drug"
"Treatment with botulinum toxin is widely viewed as safe, effective and largely devoid of serious side effects. There are two classes of Botox-related adverse events - transient and benign events, and potentially serious events. The aim of this study was to provide an overview of Botox-related side effects and advise potential management and preventive strategies. Benign side effects are well-localized, reversible and self-limited complications which develop within a few days of the injection, and they usually disappear without any treatment. The aesthetic and functional adverse effects are associated with different muscle responses to botulinum toxin or with misplacement of botulinum toxin. The serious events are sequelae due to the systemic spread of toxin leading to botulism.",literature_review,2020,https://pubmed.ncbi.nlm.nih.gov/33603602/,The whole truth about botulinum toxin - a review - PubMed
"IMPORTANCE Chronic kidney disease (CKD) is the 16th leading cause of years of life lost worldwide. Appropriate screening, diagnosis, and management by primary care clinicians are necessary to prevent adverse CKD-associated outcomes, including cardiovascular disease, end-stage kidney disease, and death. OBSERVATIONS Defined as a persistent abnormality in kidney structure or function (eg, glomerular filtration rate [GFR] <60 mL/min/1.73 m2 or albuminuria ≥30 mg per 24 hours) for more than 3 months, CKD affects 8% to 16% of the population worldwide. In developed countries, CKD is most commonly attributed to diabetes and hypertension. However, less than 5% of patients with early CKD report awareness of their disease. Among individuals diagnosed as having CKD, staging and new risk assessment tools that incorporate GFR and albuminuria can help guide treatment, monitoring, and referral strategies. Optimal management of CKD includes cardiovascular risk reduction (eg, statins and blood pressure management), treatment of albuminuria (eg, angiotensin-converting enzyme inhibitors or angiotensin II receptor blockers), avoidance of potential nephrotoxins (eg, nonsteroidal anti-inflammatory drugs), and adjustments to drug dosing (eg, many antibiotics and oral hypoglycemic agents). Patients also require monitoring for complications of CKD, such as hyperkalemia, metabolic acidosis, hyperphosphatemia, vitamin D deficiency, secondary hyperparathyroidism, and anemia. Those at high risk of CKD progression (eg, estimated GFR <30 mL/min/1.73 m2, albuminuria ≥300 mg per 24 hours, or rapid decline in estimated GFR) should be promptly referred to a nephrologist. CONCLUSIONS AND RELEVANCE Diagnosis, staging, and appropriate referral of CKD by primary care clinicians are important in reducing the burden of CKD worldwide.",literature_review,2019,https://pmc.ncbi.nlm.nih.gov/articles/PMC7015670/,Chronic Kidney Disease Diagnosis and Management - PubMed Central (PMC)
"Cultural behaviors have important implications for human health. Culture, a socially transmitted system of shared knowledge, beliefs and/or practices that varies across groups, and individuals within those groups, has been a critical mode of adaptation throughout the history of our species. Socioeconomic status, gender, religion and moral values all play into how individuals experience, conceptualize and react to their world, and therefore general understandings of cultural groups are insufficient for grasping a patient's unique experience with health and illnesses. Additionally, structural inequalities and political economy play a critical, and often overlooked, role in health and disease. Understanding how behaviors are rooted in an individual's unique cultural experience and as a response to social pressures can better equip medical professionals with the context, skills and empathy necessary for holistic care.",literature_review,2019,https://pmc.ncbi.nlm.nih.gov/articles/PMC6970345/,"Culture, behavior and health - PMC"
"Already a well-established treatment for different autonomic and movement disorders, the use of botulinum toxin type A (BoNT/A) in pain conditions is now continuously expanding. Currently, the only approved use of BoNT/A in relation to pain is the treatment of chronic migraines. However, controlled clinical studies show promising results in neuropathic and other chronic pain disorders. In comparison with other conventional and non-conventional analgesic drugs, the greatest advantages of BoNT/A use are its sustained effect after a single application and its safety. Its efficacy in certain therapy-resistant pain conditions is of special importance. Novel results in recent years has led to a better understanding of its actions, although further experimental and clinical research is warranted. Here, we summarize the effects contributing to these advantageous properties of BoNT/A in pain therapy, specific actions along the nociceptive pathway, consequences of its central activities, the molecular mechanisms of actions in neurons, and general pharmacokinetic parameters.",literature_review,2019,https://pmc.ncbi.nlm.nih.gov/articles/PMC6723487/,Mechanisms of Botulinum Toxin Type A Action on Pain - PMC
"Objective: To provide a critical appraisal of the primary clinical trials exploring the use of glabellar botulinum toxin type A (BTA) injections in the treatment of major depressive disorder (MDD) and propose future directions for research on this topic. Data Sources: A search in PubMed, Scopus, and Google Scholar databases was performed in September 2017. Search terms included (""botulinum"" OR ""botox"" OR ""abobotulinumtoxin"" OR ""onabotulinum"" OR ""onabotulinumtoxin"" OR ""botulinumtoxin"") AND (""antidepressant"" OR ""depression"" OR ""depressive"" OR ""depressed""). No other search parameters were utilized. Study Selection: Studies were selected for review if they were found to be a primary clinical trial on the use of BTA for the treatment of MDD. Data Extraction: Six studies were identified and scored by the authors using a 5-point Jadad scoring system. Results: Three of the 6 studies were found to be of high quality with a Jadad score ≥ 3. The remainder had Jadad scores of 1. Conclusions: In general, the results from the reviewed studies suggest that BTA may be a promising treatment for MDD. However, these findings need to be interpreted with caution due to several limitations of the reviewed studies such as lack of a priori hypotheses, limited sample sizes, large gender bias, and significant difficulty in ensuring blinding.",literature_review,2018,https://pubmed.ncbi.nlm.nih.gov/30326186/,Glabellar Botulinum Toxin Injections in Major Depressive Disorder: A Critical Review
"Depression is a common disorder, which often leads to poor quality of life and impaired role functioning. It is known to be a major contributor to the global burden of diseases and according to World Health Organization (WHO), depression is the fourth leading cause of disability worldwide and it is projected that by 2020, it will be the second most common leading cause of disability. This document provides clinical practice guidelines for the management of depression, including assessment, treatment options, and management of treatment-resistant depression.",literature_review,2017,https://pmc.ncbi.nlm.nih.gov/articles/PMC5310101/,Clinical Practice Guidelines for the management of Depression
"Botulinum toxin (BoNT) has been used as a treatment for excessive muscle stiffness, spasticity, and dystonia. BoNT for approximately 40 years, and has recently been used to treat various types of neuropathic pain. The mechanism by which BoNT acts on neuropathic pain involves inhibiting the release of inflammatory mediators and peripheral neurotransmitters from sensory nerves. Recent journals have demonstrated that BoNT is effective for neuropathic pain, such as postherpetic neuralgia, trigeminal neuralgia, and peripheral neuralgia. The purpose of this review is to summarize the experimental and clinical evidence of the mechanism by which BoNT acts on various types of neuropathic pain and describe why BoNT can be applied as treatment.",literature_review,2017,https://pmc.ncbi.nlm.nih.gov/articles/PMC5618193/,Botulinum Toxin for the Treatment of Neuropathic Pain - PMC
"The treatment of glabellar frown lines with botulinum toxin injection is one of the most prevalent procedures in esthetic medicine. It is possible that the popularity of this intervention is not only owing to its cosmetic effect but also to modulatory effects on mood and affectivity. Recently, a series of studies including three randomized controlled trials have consistently shown that such effects can be used in the treatment of depression. Predominantly female patients suffering from partly chronic and treatment resistant unipolar depression experienced a quick, strong and sustained improvement in depressive symptoms after a single glabellar treatment with botulinum toxin A as a sole or adjunctive therapy. If these findings are further corroborated in additional studies, the ever-growing spectrum of applications for botulinum toxin may spread into the field of psychiatry, showing that the superficial paralysis of facial muscles may, probably via proprioceptive feedback mechanisms, have profound effects on the emotional brain.",literature_review,2015,https://pubmed.ncbi.nlm.nih.gov/26415901/,Depression--An emerging indication for botulinum toxin treatment
"The efficacy of lamotrigine in the treatment of focal epilepsies have already been reported in several case reports and open studies, which is thought to act by inhibiting glutamate release through voltage-sensitive sodium channels blockade and neuronal membrane stabilization. However, recent findings have also illustrated the importance of lamotrigine in alleviating the depressive symptoms of bipolar disorder, without causing mood destabilization or precipitating mania. Currently, no mood stabilizers are available having equal efficacy in the treatment of both mania and depression, two of which forms the extreme sides of the bipolar disorder. Lamotrigine, a well established anticonvulsant has received regulatory approval for the treatment and prevention of bipolar depression in more than 30 countries worldwide. Lamotrigine, acts through several molecular targets and overcomes the major limitation of other conventional antidepressants by stabilizing mood from ""below baseline"" thereby preventing switches to mania or episode acceleration, thus being effective for bipolar I disorder. Recent studies have also suggested that these observations could also be extended to patients with bipolar II disorder. Thus, lamotrigine may supposedly fulfill the unmet requirement for an effective depression mood stabilizer.",literature_review,2015,https://pmc.ncbi.nlm.nih.gov/articles/PMC4615936/,Management of bipolar depression with lamotrigine: an antiepileptic mood stabilizer
"Botulinum neurotoxins (BoNTs) cause flaccid paralysis by interfering with vesicle fusion and neurotransmitter release in the neuronal cells. BoNTs are the most widely used therapeutic proteins. BoNT/A was approved by the U.S. FDA to treat strabismus, blepharospam, and hemifacial spasm as early as 1989 and then for treatment of cervical dystonia, glabellar facial lines, axillary hyperhidrosis, chronic migraine and for cosmetic use. Due to its high efficacy, longevity of action and satisfactory safety profile, it has been used empirically in a variety of ophthalmological, gastrointestinal, urological, orthopedic, dermatological, secretory, and painful disorders. Currently available BoNT therapies are limited to neuronal indications with the requirement of periodic injections resulting in immune-resistance for some indications. Recent understanding of the structure-function relationship of BoNTs prompted the engineering of novel BoNTs to extend therapeutic interventions in non-neuronal systems and to overcome the immune-resistance issue. Much research still needs to be done to improve and extend the medical uses of BoNTs.",literature_review,2012,https://pmc.ncbi.nlm.nih.gov/articles/PMC3496996/,"Clinical Uses of Botulinum Neurotoxins: Current Indications, Limitations and Future Developments"
"OnabotulinumtoxinA is an injectable medication that produces muscle relaxation through local chemical denervation at the neuromuscular junction. Discovery of onabotulinumtoxinA's aesthetic benefits occurred serendipitously in the 1980s at the intersection of several medical disciplines, including ophthalmology, neurology, otolaryngology, and dermatology. Patients receiving onabotulinumtoxinA for blepharospasm, hemifacial spasm, and dystonia noticed their periorbital wrinkles disappearing, particularly frown lines between the eyebrows called glabellar lines (GL). Aesthetic use of onabotulinumtoxinA necessitated rigorous training programs and vigilant monitoring by Allergan. Approval for the GL indication was based on 2 similarly designed, double-blind, randomized, multicenter clinical studies. Subjects with moderate to severe GL receiving onabotulinumtoxinA achieved significantly greater improvement in GL severity than those receiving placebo. In subsequent studies, more than 80% of subjects were satisfied with onabotulinumtoxinA treatment through day 60, and many reported looking approximately 4 years younger at weeks 4 and 12 than at baseline. OnabotulinumtoxinA has a rapid onset of action, and peak effect occurs between 30 and 60 days. The median duration of response for dynamic GL in the initial studies was 120 days and response progressively improved with subsequent treatments. OnabotulinumtoxinA was well tolerated, and the 2 most common adverse events, headache and blepharoptosis, tended to decrease in frequency with repeat treatment.",clinical_trial_phase_3,2023,https://pmc.ncbi.nlm.nih.gov/articles/PMC10374180/,"Treatment of glabellar lines with Botox (onabotulinumtoxinA): Development, insights, and impact"
"This study assessed the long-term effects of botulinum toxin type A (BoNT-A) in subjective pain, pain sensibility, and muscle thickness in persistent myofascial temporomandibular-disorder pain (MFP-TMD) patients. Fourteen female subjects with persistent MFP received BoNT-A treatment with different doses (10U-25U for temporalis muscle and 30U-75U for masseter muscle). The treatment was injected bilaterally in the masseter and anterior temporalis muscles in a single session. Clinical measurements included: self-perceived pain (VAS), pain sensibility (PPT), and muscles thickness (ultrasonography). Follow-up occurred 1, 3, 6, and 72 months after treatment for VAS and PPT and 1, 3, and 72 months for ultrasonography. For statistical analysis, the Friedman test with the Bonferroni test for multiple comparisons as a post hoc test was used for non-parametric repeated measures comparisons among the evaluation times. A 5% probability level was considered significant in all tests. VAS values presented a significant decrease throughout the study (p < 0.05). Regarding PPT values, a significant increase was found when comparing baseline data with post-treatment follow-ups (p < 0.05), and even though a significant decrease was found in muscle thickness when baseline values were compared with the 1- and 3-months assessments, no differences were found when compared with the 72 months follow-up (p > 0.05). A single injection of BoNT-A presents long-term effects in reducing pain in persistent MFP-TMD patients, and a reversibility of adverse effects on masticatory-muscle thickness.",clinical_trial_phase_3,2022,https://pmc.ncbi.nlm.nih.gov/articles/PMC9721314/,Long-Term Effects of a Single Application of Botulinum Toxin Type A in Temporomandibular Myofascial Pain Patients: A Controlled Clinical Trial
